{
  "architecture": "x86_64",
  "asset_digest": "sha256:aaaaaaaaaaaaaaaaaaaaaaaaaaaaaaaaaaaaaaaaaaaaaaaaaaaaaaaaaaaaaaaa",
  "asset_id": 7102,
  "closure_digest": "3333333333333333333333333333333333333333333333333333333333333333",
  "manifest_digest": "ecbe6e70cb562f3ae1161a27ddc0f380d4746cc32f839cce8a8da9439d5838ea",
  "platform": "Linux-X64",
  "product_name": "velnor-workflow-policy-validator",
  "product_namespace": "velnor.workflow-policy-validator",
  "release_id": 7101,
  "release_tag": "velnor-workflow-policy-validator-v1-bbbbbbbbbbbbbbbbbbbbbbbbbbbbbbbbbbbbbbbb",
  "schema": "velnor.workflow-policy-validator.release-manifest.v1",
  "source_sha": "dddddddddddddddddddddddddddddddddddddddd",
  "source_tree_sha": "cccccccccccccccccccccccccccccccccccccccc",
  "target_sha": "aaaaaaaaaaaaaaaaaaaaaaaaaaaaaaaaaaaaaaaa"
}
