{"architecture":"x86_64","asset_digest":"sha256:aaaaaaaaaaaaaaaaaaaaaaaaaaaaaaaaaaaaaaaaaaaaaaaaaaaaaaaaaaaaaaaa","asset_id":1,"closure_digest":"aaaaaaaaaaaaaaaaaaaaaaaaaaaaaaaaaaaaaaaaaaaaaaaaaaaaaaaaaaaaaaaa","manifest_digest":"aaaaaaaaaaaaaaaaaaaaaaaaaaaaaaaaaaaaaaaaaaaaaaaaaaaaaaaaaaaaaaaa","platform":"Linux-X64","product_name":"velnor-workflow-policy-validator","product_namespace":"velnor.workflow-policy-validator","release_id":1,"release_tag":"velnor-workflow-policy-validator-v1-aaaaaaaaaaaaaaaaaaaaaaaaaaaaaaaaaaaaaaaa","schema":"velnor.workflow-policy-validator.release-manifest.v1","source_sha":"aaaaaaaaaaaaaaaaaaaaaaaaaaaaaaaaaaaaaaaa","source_tree_sha":"aaaaaaaaaaaaaaaaaaaaaaaaaaaaaaaaaaaaaaaa","target_sha":"aaaaaaaaaaaaaaaaaaaaaaaaaaaaaaaaaaaaaaaa"}
